{
  "taxonomy_version": "7.0",
  "method_code": "T0011",
  "method": "Phone contact",
  "modus_code": "T0019",
  "modus": "Safe account fraud",
  "initiator_code": "T0049",
  "initiator": "Customer",
  "labels_tags_codes": [
    "T0065",
    "T0080"
  ],
  "labels_tags": [
    "Fake bank / financial institution",
    "Impersonation"
  ],
  "payment_instrument_code": "T0115",
  "payment_instrument": "Account-to-account transaction"
}
